{
  "$schema": "https://json-schema.org/draft/2020-12/schema",
  "$id": "https://quadstick.org/schemas/adaptive-device-v1.json",
  "title": "Adaptive Device",
  "type": "object",
  "additionalProperties": false,
  "required": ["schemaVersion", "id", "name", "manufacturer", "status", "inputs"],
  "properties": {
    "schemaVersion": { "const": 1 },
    "id": { "type": "string", "pattern": "^[a-z0-9]+(?:-[a-z0-9]+)*$" },
    "name": { "type": "string", "minLength": 1, "maxLength": 120 },
    "manufacturer": { "type": "string", "minLength": 1, "maxLength": 120 },
    "status": { "enum": ["published", "draft"] },
    "inputs": {
      "type": "array",
      "minItems": 1,
      "items": {
        "type": "object",
        "additionalProperties": false,
        "required": ["id", "label", "kind"],
        "properties": {
          "id": { "type": "string", "pattern": "^[a-z0-9]+(?:-[a-z0-9]+)*$" },
          "label": { "type": "string", "minLength": 1, "maxLength": 80 },
          "kind": { "enum": ["digital", "analog-2d", "analog-1d", "pointer", "switch", "sensor"] }
        }
      }
    }
  }
}
